<?xml version="1.0"  encoding="ISO-8859-1"  standalone="no" ?>
<!DOCTYPE database PUBLIC "http://virtual-worlds.biz/Mill"  "http://www.virtual-worlds.biz/dtds/mill.dtd">
<database name="adrs_data">
        
        <table name="standard_user" description="A user" >
           
                <column name="user_id"  
                        primaryKey='true'
                        type='INTEGER'
                        adaTypeName='Integer'
                        description=""/>
                <column name="username"  
                        required="true"
                        default=''
                        type="CHAR"
                        size="16"
                        description=""/>
                <column name='password'
                        default=''
                        type='CHAR'
                        size='32' />
                <column name='type1'
                        type='ENUM'
                        values='a3 b4 c5'
                        />
                <column name='type2'
                        type='ENUM'
                        values='v1 v2 v3'
                        />
                <column name='a_bigint' type='BIGINT'/>
                <column name='a_real' type='REAL'/>
                <column name='a_decimal' type='DECIMAL' size='12' scale='2'/>
                <column name='a_double' type='DOUBLE'/>
                <column name='a_boolean' type='BOOLEAN'/>
                <column name='a_varchar' type='VARCHAR' size='200'/>
                <column name='a_date'
                        type='DATE'
                        default='0000-00-00'
                         />
        </table>

        <table name="standard_group" description="Group a user belongs to">        
                <column name="name"
                        type='CHAR'
                        size='30'
                        primaryKey='true'
                        default='SATTSIM'
                        description="Model Name"/>
                <column name="description"
                        type='CHAR'
                        size='120'
                        description="Description"/>
        </table>
        
        <table name="group_members" description="Group a user belongs to">        
                <column name="group_name"
                        type='CHAR'
                        size='30'
                        primaryKey='true'
                        default=''
                        description="Model Name"/>
                <column name="user_id"  
                        primaryKey='true'
                        type='INTEGER'
                        description=""/>
                <foreign-key foreignTable="standard_group"   onDelete="CASCADE">
                     <reference foreign="name" local="group_name"/>
                </foreign-key>
                <foreign-key foreignTable="standard_user"   onDelete="CASCADE">
                     <reference foreign="user_id" local="user_id"/>
                </foreign-key>
        </table>
</database>
